<?xml version="1.0" encoding="UTF-8" standalone="no"?>
<xsd:schema xmlns:xsd="http://www.w3.org/2001/XMLSchema" elementFormDefault="qualified">

    <xsd:element name="SoundingModels">
        <xsd:complexType>
            <xsd:sequence maxOccurs="1" minOccurs="1">
                <xsd:element ref="SoundingModel" 
                            maxOccurs="unbounded" 
                            minOccurs="1">
                </xsd:element>
            </xsd:sequence>
        </xsd:complexType>
    </xsd:element>

    <xsd:element name="SoundingModel">
        <xsd:complexType>
            <xsd:sequence> 
                <xsd:element name="Name" type="xsd:string"/>

                <xsd:element name="swLat" minOccurs="0"
                             type="xsd:double"/>
                <xsd:element name="swLon" minOccurs="0"
                             type="xsd:double"/>
                <xsd:element name="neLat" minOccurs="0"
                             type="xsd:double"/>
                <xsd:element name="neLon" minOccurs="0"
                             type="xsd:double"/>

                <xsd:element name="validStartDate" minOccurs="0"
                             type="xsd:string"/>
                <xsd:element name="validEndDate" minOccurs="0"
                             type="xsd:string"/>

                <xsd:element ref="SoundingLevels" 
                     maxOccurs="1" minOccurs="1"/>
            </xsd:sequence>
         </xsd:complexType>
    </xsd:element>

    <xsd:element name="SoundingLevels">
        <xsd:complexType>
            <xsd:sequence> 
                <xsd:element name="levelValues" minOccurs="1" 
                                                maxOccurs="unbounded">
                    <xsd:complexType>
                        <xsd:sequence> 
                            <xsd:element name="pressure" type="xsd:double"
                                         minOccurs="1" maxOccurs="1"/>
                            <xsd:element name="temperature" type="xsd:double"
                                         minOccurs="1" maxOccurs="1"/>
                            <xsd:element name="height" type="xsd:double"
                                         minOccurs="1" maxOccurs="1"/>
                        </xsd:sequence> 
                    </xsd:complexType>
                </xsd:element>
            </xsd:sequence>
         </xsd:complexType>
    </xsd:element>
</xsd:schema>
